{
  "schema": "macguard.event/1",
  "event_id": "mg-metrics-2026-10-24",
  "type": "metrics.snapshot",
  "occurred_at": "2026-10-24T06:00:00Z",
  "tenant_id": "macguard",
  "source": {
    "kind": "gateway",
    "id": "macguard-gateway"
  },
  "status": "ok",
  "data": {
    "day": "2026-10-23",
    "requests": 0,
    "server_errors": 0,
    "error_rate": null,
    "collector_runs_24h": 0,
    "collector_ok_24h": 0
  }
}
